{
  "schema_version": "1.0.0",
  "owner": "SuriyaBoon",
  "generated_at": "2026-07-28T17:15:00+07:00",
  "source": "connected_github_app",
  "repositories": [
    {"id": 1215810606, "name": "Architech", "full_name": "SuriyaBoon/Architech", "visibility": "private", "default_branch": "master", "clone_url": "https://github.com/SuriyaBoon/Architech.git", "archived": false},
    {"id": 1216180551, "name": "Hotel-WLAN-Network", "full_name": "SuriyaBoon/Hotel-WLAN-Network", "visibility": "public", "default_branch": "main", "clone_url": "https://github.com/SuriyaBoon/Hotel-WLAN-Network.git", "archived": false},
    {"id": 1220295528, "name": "home-lab-v1", "full_name": "SuriyaBoon/home-lab-v1", "visibility": "public", "default_branch": "main", "clone_url": "https://github.com/SuriyaBoon/home-lab-v1.git", "archived": false},
    {"id": 1221156218, "name": "home-lab-v2", "full_name": "SuriyaBoon/home-lab-v2", "visibility": "public", "default_branch": "main", "clone_url": "https://github.com/SuriyaBoon/home-lab-v2.git", "archived": false},
    {"id": 1221621286, "name": "home-lab-v3", "full_name": "SuriyaBoon/home-lab-v3", "visibility": "public", "default_branch": "main", "clone_url": "https://github.com/SuriyaBoon/home-lab-v3.git", "archived": false},
    {"id": 1223747018, "name": "home-lab-v4", "full_name": "SuriyaBoon/home-lab-v4", "visibility": "public", "default_branch": "main", "clone_url": "https://github.com/SuriyaBoon/home-lab-v4.git", "archived": false},
    {"id": 1224196487, "name": "home-lab-v5", "full_name": "SuriyaBoon/home-lab-v5", "visibility": "public", "default_branch": "main", "clone_url": "https://github.com/SuriyaBoon/home-lab-v5.git", "archived": false},
    {"id": 1252742962, "name": "HackTheBox-SmartHire-", "full_name": "SuriyaBoon/HackTheBox-SmartHire-", "visibility": "public", "default_branch": "main", "clone_url": "https://github.com/SuriyaBoon/HackTheBox-SmartHire-.git", "archived": false},
    {"id": 1254684507, "name": "DevHub-HackTheBox-ss11", "full_name": "SuriyaBoon/DevHub-HackTheBox-ss11", "visibility": "public", "default_branch": "main", "clone_url": "https://github.com/SuriyaBoon/DevHub-HackTheBox-ss11.git", "archived": false},
    {"id": 1255991365, "name": "HackTheBox-Silentium", "full_name": "SuriyaBoon/HackTheBox-Silentium", "visibility": "public", "default_branch": "main", "clone_url": "https://github.com/SuriyaBoon/HackTheBox-Silentium.git", "archived": false},
    {"id": 1258822910, "name": "HackTheBox-Facts", "full_name": "SuriyaBoon/HackTheBox-Facts", "visibility": "public", "default_branch": "main", "clone_url": "https://github.com/SuriyaBoon/HackTheBox-Facts.git", "archived": false},
    {"id": 1261791805, "name": "Connected-HackTheBox-ss11", "full_name": "SuriyaBoon/Connected-HackTheBox-ss11", "visibility": "public", "default_branch": "main", "clone_url": "https://github.com/SuriyaBoon/Connected-HackTheBox-ss11.git", "archived": false},
    {"id": 1281752386, "name": "personal-knowledge-os", "full_name": "SuriyaBoon/personal-knowledge-os", "visibility": "private", "default_branch": "main", "clone_url": "https://github.com/SuriyaBoon/personal-knowledge-os.git", "archived": false},
    {"id": 1284610385, "name": "PKOS", "full_name": "SuriyaBoon/PKOS", "visibility": "private", "default_branch": "main", "clone_url": "https://github.com/SuriyaBoon/PKOS.git", "archived": false},
    {"id": 1292170249, "name": "Netsentinel", "full_name": "SuriyaBoon/Netsentinel", "visibility": "public", "default_branch": "main", "clone_url": "https://github.com/SuriyaBoon/Netsentinel.git", "archived": false},
    {"id": 1292172250, "name": "LogWatcher", "full_name": "SuriyaBoon/LogWatcher", "visibility": "public", "default_branch": "main", "clone_url": "https://github.com/SuriyaBoon/LogWatcher.git", "archived": false},
    {"id": 1292281697, "name": "Helpdesk-Simulator", "full_name": "SuriyaBoon/Helpdesk-Simulator", "visibility": "public", "default_branch": "main", "clone_url": "https://github.com/SuriyaBoon/Helpdesk-Simulator.git", "archived": false},
    {"id": 1293518110, "name": "Backup-dr-lab", "full_name": "SuriyaBoon/Backup-dr-lab", "visibility": "public", "default_branch": "main", "clone_url": "https://github.com/SuriyaBoon/Backup-dr-lab.git", "archived": false},
    {"id": 1294895365, "name": "SOC-Homelab-Elastic-Stack-security-monitoring", "full_name": "SuriyaBoon/SOC-Homelab-Elastic-Stack-security-monitoring", "visibility": "public", "default_branch": "main", "clone_url": "https://github.com/SuriyaBoon/SOC-Homelab-Elastic-Stack-security-monitoring.git", "archived": false},
    {"id": 1299181006, "name": "SentinelGRC", "full_name": "SuriyaBoon/SentinelGRC", "visibility": "public", "default_branch": "main", "clone_url": "https://github.com/SuriyaBoon/SentinelGRC.git", "archived": false},
    {"id": 1307606178, "name": "Second-Brain-Base", "full_name": "SuriyaBoon/Second-Brain-Base", "visibility": "private", "default_branch": "main", "clone_url": "https://github.com/SuriyaBoon/Second-Brain-Base.git", "archived": false},
    {"id": 1307742178, "name": "JML-Automation", "full_name": "SuriyaBoon/JML-Automation", "visibility": "public", "default_branch": "agent/jml-mvp", "clone_url": "https://github.com/SuriyaBoon/JML-Automation.git", "archived": false},
    {"id": 1308683476, "name": "Mini-SOAR", "full_name": "SuriyaBoon/Mini-SOAR", "visibility": "public", "default_branch": "main", "clone_url": "https://github.com/SuriyaBoon/Mini-SOAR.git", "archived": false},
    {"id": 1314807661, "name": "Agentic-Engineering-Control-Plane", "full_name": "SuriyaBoon/Agentic-Engineering-Control-Plane", "visibility": "public", "default_branch": "main", "clone_url": "https://github.com/SuriyaBoon/Agentic-Engineering-Control-Plane.git", "archived": false}
  ]
}
